{"$schema": "../../schemas/SCHEMA-000015-contract.json", "id": "AIOS-CONTRACT-000032", "name": "cost_estimation", "version": "1.0.0", "description": "Estimates the resource cost of a plan: model tokens, wall-clock minutes, disk delta, and number of files touched. Deterministic given plan + declared engine budgets. Used by the scheduler to respect performance budgets and by the operator to approve plans.", "inputs": [{"name": "plan", "type": "object", "required": true, "description": "ExecutionPlan from AIOS-CONTRACT-000030."}, {"name": "engine_budgets", "type": "object", "required": false, "description": "Map engine_id -> performance_budget (declared in each module.json).", "default": {}}], "outputs": [{"name": "cost_report", "type": "object", "description": "{ tokens_estimated, minutes_min, minutes_max, disk_delta_bytes, files_touched, budget_violations: [{ engine_id, field, declared, needed }] }"}], "side_effects": ["Emits AIOS-EVENT-000023 cost_estimated"], "error_codes": [{"code": "PLANNER_BUDGET_VIOLATION", "message": "A step would exceed its engine's declared performance_budget.", "recovery": "Surface the violation in budget_violations; do not auto-approve the plan; suggest splitting the step."}, {"code": "PLANNER_NO_ENGINE_FOR_STEP", "message": "A step's capability has no resolved engine.", "recovery": "Mark cost as unknown for that step; log; continue with the rest."}], "performance_guarantees": {"max_latency_ms": 50, "max_memory_mb": 16}, "examples": ["plan with 4 steps each max_latency=250ms -> minutes_max approx ceil(sum_latencies/60000) + model_time."]}