{"$schema":"../../schemas/SCHEMA-000015-contract.json","id":"AIOS-BRAIN-000008","name":"History Brain","version":"1.0.0","description":"Engineering timeline: chronological record of every action, decision, and outcome. Powers the timeline visualization, project health trends, and learning engine. Append-only — nothing is ever deleted (Law 13 traceability).","inputs":[{"name":"since","type":"string","required":false},{"name":"scope","type":"string","required":false}],"outputs":[{"name":"timeline","type":"object","description":"{ events: [{timestamp,type,summary,request_id,duration_ms}], summary: {total_events, by_type} }"}]}