{"$schema": "../../schemas/SCHEMA-000015-contract.json", "id": "AIOS-CONTRACT-000082", "name": "feature_specification", "version": "1.0.0", "description": "Produces a structured feature specification from a natural-language feature request and project context from the brain. The spec defines boundaries, interfaces, data models, acceptance criteria, and test scope — everything the code engine (000009) needs to implement.", "inputs": [{"name": "request", "type": "string", "required": true, "description": "Natural-language feature description."}, {"name": "project_context", "type": "object", "required": false, "description": "Brain knowledge graph slice for context-aware spec.", "default": null}], "outputs": [{"name": "feature_spec", "type": "object", "description": "{ feature_id: AIOS-FEATURE-NNNNNN, name, boundaries: string[], interfaces: [{name, contract_ref}], data_models: [{name, fields}], acceptance_criteria: string[], test_scope: string[], depends_on_features: string[] }"}], "side_effects": ["Emits AIOS-EVENT-000080 feature_spec_created", "Persists spec to the memory module"], "error_codes": [{"code": "FEATURE_TOO_VAGUE", "message": "Feature request cannot be turned into a structured spec.", "recovery": "Per Law 12: surface what's missing; request minimal clarification; never fabricate boundaries."}, {"code": "FEATURE_CONFLICT", "message": "Feature boundaries overlap with an existing feature.", "recovery": "List the overlapping feature id and suggest merge or re-scoping."}], "performance_guarantees": {"max_latency_ms": 400, "max_memory_mb": 96}, "examples": ["request='user auth with email+oauth' -> feature_spec with 2 auth interfaces, 3 data models, 5 acceptance criteria."]}