{"$schema": "../../schemas/SCHEMA-000015-contract.json", "id": "AIOS-CONTRACT-000060", "name": "code_generation", "version": "1.0.0", "description": "Given an execution plan step + feature spec + project context, produces file changes (create/edit/delete). Respects existing code conventions and generates inline documentation per Engineering Law 6. Every output file carries a traceable origin.", "inputs": [{"name": "plan_step", "type": "object", "required": true, "description": "A single step from the execution plan { step_id, capability_id, inputs }"}, {"name": "feature_spec", "type": "object", "required": false, "description": "FeatureSpec from feature module if this step implements a feature.", "default": null}, {"name": "project_context", "type": "object", "required": false, "description": "Brain graph slice and existing file paths for convention awareness.", "default": null}], "outputs": [{"name": "changes", "type": "array", "description": "[{ file_path, operation: create|edit|delete, content, diff_summary, trace_back: {plan_step_id, capability_id} }]"}], "side_effects": ["Writes files to disk (through the kernel for change approval first)", "Emits AIOS-EVENT-000060 code_generated"], "error_codes": [{"code": "CODE_NOTHING_CHANGED", "message": "Plan step would produce zero file changes.", "recovery": "Return empty changes list; do not create empty files (Constitution Principle 15)."}, {"code": "CODE_FILE_EXISTS", "message": "create operation on an existing path blocked.", "recovery": "Suggest edit instead; never silently overwrite (Law 4)."}, {"code": "CODE_READ_ONLY", "message": "Target path is in a read-only module (kernel/runtime/constitution).", "recovery": "Refuse to modify; surface the immutable module id (Law 16)."}], "performance_guarantees": {"max_latency_ms": 500, "max_memory_mb": 256}, "examples": ["plan_step from goal_decomposition with capability_id=code_generation -> creates 3 files with trace_back to the step."]}