{"$schema": "../../schemas/SCHEMA-000015-contract.json", "id": "AIOS-CONTRACT-000041", "name": "file_indexing", "version": "1.0.0", "description": "Indexes files, symbols, dependencies, and routes into a persisted knowledge graph. Incremental: only files whose hash changed are re-parsed (Law 8, Law 14).", "inputs": [{"name": "project_root", "type": "string", "required": true, "description": "Absolute path to the project root."}, {"name": "changed_files", "type": "array", "required": false, "description": "Paths to re-index; omit for full re-index.", "default": null}], "outputs": [{"name": "graph_delta", "type": "object", "description": "{ files_indexed, symbols_added, symbols_removed, edges_changed, graph_version }"}], "side_effects": ["Persists updated graph to memory module", "Emits AIOS-EVENT-000040 graph_updated"], "error_codes": [{"code": "BRAIN_PARSE_FAILED", "message": "A file could not be parsed by any registered language pack."}, {"code": "BRAIN_WRITE_FAILED", "message": "Memory module refused to persist the graph."}], "performance_guarantees": {"max_latency_ms": 300, "max_memory_mb": 128}, "examples": ["project_root=/workspace + changed_files=[src/auth.rs] -> graph_delta with symbols_added=12"]}