{"$schema": "../../schemas/SCHEMA-000015-contract.json", "id": "AIOS-CONTRACT-000101", "name": "ci_cd_orchestration", "version": "1.0.0", "description": "Generates CI/CD pipeline configurations (GitHub Actions, GitLab CI, etc.) from the deployment plan and project requirements. Maps each build/deploy step to the CI platform's format.", "inputs": [{"name": "deployment_plan", "type": "object", "required": true, "description": "DeploymentPlan from AIOS-CONTRACT-000100."}, {"name": "platform", "type": "string", "required": false, "description": "CI platform: github_actions | gitlab_ci | jenkins | custom", "default": "github_actions"}], "outputs": [{"name": "pipeline_config", "type": "object", "description": "{ platform, files: [{path, content}], triggers: string[], secrets_required: string[] }"}], "side_effects": ["Writes pipeline config files to the project root"], "error_codes": [{"code": "DEVOPS_PLATFORM_UNSUPPORTED", "message": "CI platform is not supported.", "recovery": "List supported platforms; do not generate an unsupported format (Law 12)."}], "performance_guarantees": {"max_latency_ms": 300, "max_memory_mb": 64}, "examples": ["deployment_plan + platform=github_actions -> pipeline_config with .github/workflows/deploy.yml."]}