{"$schema": "../../schemas/SCHEMA-000015-contract.json", "id": "AIOS-CONTRACT-000010", "name": "request_routing", "version": "1.0.0", "description": "Parses a raw user request string into a structured CapabilityDemand — an ordered list of capabilities required to satisfy the request. Single entry point into the AIOS execution pipeline. Per Constitution Principle 1 (Capability-First), the kernel does 90% routing, 10% generation.", "inputs": [{"name": "request_text", "type": "string", "required": true, "description": "Raw natural-language request from the operator or CLI.", "validation": "non-empty, max_length=16384"}, {"name": "session_context", "type": "object", "required": false, "description": "Active session metadata: project root, active brain, loaded packs. Empty when no session.", "default": {}}], "outputs": [{"name": "demand", "type": "object", "description": "CapabilityDemand { request_id: AIOS-REQ-NNNNNN, capabilities: AIOS-CAPABILITY-NNNNNN[], intent: string, constraints: object }"}, {"name": "confidence", "type": "number", "description": "Routing confidence 0.0-1.0. Below 0.6 triggers a clarification request per Engineering Law 12."}], "side_effects": ["Emits AIOS-EVENT-000001 request_received", "Allocates a new AIOS-REQ-NNNNNN request id"], "error_codes": [{"code": "KERNEL_EMPTY_REQUEST", "message": "Request text is empty or whitespace only.", "recovery": "Prompt operator for a non-empty request."}, {"code": "KERNEL_UNROUTABLE", "message": "No installed capability matches the request intent.", "recovery": "Emit clarification request (Engineering Law 12) listing candidate capabilities and required packs."}, {"code": "KERNEL_AMBIGUOUS", "message": "Multiple capabilities match with confidence gap < 0.15.", "recovery": "Present ranked candidates; default to the highest-confidence unless operator disambiguates."}], "performance_guarantees": {"max_latency_ms": 150, "max_memory_mb": 32}, "examples": ["{ request_text: 'build a user-auth feature with email + oauth' } -> demand.capabilities = [goal_decomposition, project_understanding, code_generation, unit_testing, code_review]"]}