{"$schema":"../../schemas/SCHEMA-000015-contract.json","id":"AIOS-BRAIN-000007","name":"Execution Brain","version":"1.0.0","description":"Tracks execution history: plan steps, gates passed/failed, artifacts produced, rollbacks triggered. Enables resumability — a paused request can be continued from the last completed phase (same state = same continuation per Constitution Principle 4).","inputs":[{"name":"request_id","type":"string","required":true},{"name":"since","type":"string","required":false}],"outputs":[{"name":"execution_history","type":"object","description":"{ phases: [{phase,status,gate,started,completed,artifacts[]}], current_state, rollbacks: [{from,to,reason}] }"}]}