{"id":"AIOS-ENTERPRISE-000040","name":"Decision Journal","version":"1.0.0","description":"Searchable, filterable view of all ADRs in the Decision Brain. Supports full-text search, tag filtering, and export to PDF/Markdown.","inputs":[{"name":"query","type":"string","required":false},{"name":"tags","type":"array","required":false}],"outputs":[{"name":"results","type":"object","description":"{ entries:[{id,title,status,date,tags,summary}], total }"}]}