{"$schema":"../../schemas/SCHEMA-000015-contract.json","id":"AIOS-BRAIN-000005","name":"Decision Brain","version":"1.0.0","description":"Architectural Decision Record (ADR) system. Every major decision is logged with context, alternatives, trade-offs, and the final choice. The decision journal enables traceability per Constitution Principle 14 and Engineering Law 13.","inputs":[{"name":"record","type":"object","required":false},{"name":"query","type":"string","required":false}],"outputs":[{"name":"decision_log","type":"object","description":"{ entries: [{id,title,context,alternatives,decision,consequences,timestamp}], total }"}]}