{"$schema": "../../schemas/SCHEMA-000015-contract.json", "id": "AIOS-CONTRACT-000092", "name": "vulnerability_scanning", "version": "1.0.0", "description": "Scans dependencies, configurations, and source code for known vulnerabilities. Cross-references dependency manifests against CVE databases. Produces a prioritized vulnerability list.", "inputs": [{"name": "manifest_path", "type": "string", "required": true, "description": "Path to the dependency manifest (Cargo.toml, package.json, etc.)"}, {"name": "severity_threshold", "type": "string", "required": false, "description": "Minimum CVSS score or severity to report.", "default": "high"}], "outputs": [{"name": "vuln_report", "type": "object", "description": "{ vulns: [{cve, severity, cvss_score, affected, fixed_in, description, remediation}], critical_count, high_count, medium_count, scan_time }"}], "side_effects": ["Caches CVE lookup results with TTL (Law 8)", "Emits AIOS-EVENT-000090 scan_completed"], "error_codes": [{"code": "SECURITY_MANIFEST_NOT_FOUND", "message": "No dependency manifest at the given path.", "recovery": "Return empty report; not an error."}, {"code": "SECURITY_CVE_DATABASE_OFFLINE", "message": "Cannot reach CVE database (working in offline-first mode).", "recovery": "Use the local cached snapshot; report staleness."}], "performance_guarantees": {"max_latency_ms": 5000, "max_memory_mb": 64}, "examples": ["manifest_path=Cargo.toml -> vuln_report with CVEs affecting crates."]}