{"$schema": "../../schemas/SCHEMA-000015-contract.json", "id": "AIOS-CONTRACT-000080", "name": "code_review", "version": "1.0.0", "description": "Reviews a set of code changes (diff or file list) against project conventions, architecture rules, and best practices. Returns actionable comments graded by severity (critical/major/minor/nit). Embodies Engineering Law 12: never fabricate issues.", "inputs": [{"name": "changes", "type": "array", "required": true, "description": "[{ file_path, operation, content or diff }] from the code engine output."}, {"name": "review_profile", "type": "string", "required": false, "description": "Review style: thorough (everything) | safety (security+correctness only) | style (conventions only).", "default": "thorough"}], "outputs": [{"name": "review", "type": "object", "description": "{ overall_score_0to100, comments: [{file, line, severity, issue, suggestion, category}], critical_count, major_count, pass: bool }"}], "side_effects": ["Emits AIOS-EVENT-000080 review_completed"], "error_codes": [{"code": "REVIEW_DIFF_PARSE_FAILED", "message": "Could not parse the diff or file content.", "recovery": "Skip the file and continue; list unparsed files."}, {"code": "REVIEW_TOO_MANY_COMMENTS", "message": "Comment count exceeds the configured max_comments.", "recovery": "Return top N by severity; fold the rest into a summary bucket."}], "performance_guarantees": {"max_latency_ms": 400, "max_memory_mb": 128}, "examples": ["changes from code_generation output -> review with 3 critical (security), 5 major (convention), pass=false until critical fixed."]}