{"id":"AIOS-ENTERPRISE-000070","name":"Knowledge Base","version":"1.0.0","description":"Searchable repository of project knowledge: conventions, idioms, known issues, architecture decisions, and team practices. Queried by agents for context-aware generation.","inputs":[{"name":"query","type":"string","required":true}],"outputs":[{"name":"results","type":"object","description":"{ entries:[{id,topic,content,source,relevance}], total }"}]}