{"$schema": "../../schemas/SCHEMA-000015-contract.json", "id": "AIOS-CONTRACT-000060", "name": "persistence", "version": "1.0.0", "description": "Key-value + append-only-log persistence API. Other modules (kernel state machine, runtime event bus, planner plans, brain graph) write through this contract. Guarantees atomic per-op durability and monotonic sequence numbers for event-log appends.", "inputs": [{"name": "namespace", "type": "string", "required": true, "description": "Storage namespace: 'state' | 'events' | 'plans' | 'brain_graph' | 'cache' | 'logs'.", "validation": "enum namespace"}, {"name": "op", "type": "string", "required": true, "description": "get | put | append | delete | snapshot", "validation": "enum op"}, {"name": "key", "type": "string", "required": false, "description": "Key within the namespace for get/put/delete.", "default": null}, {"name": "value", "type": "object", "required": false, "description": "Value for put/append.", "default": null}], "outputs": [{"name": "result", "type": "object", "description": "{ value (for get), sequence (for append), ok: bool, error: string? }"}], "side_effects": ["Writes to aios/.cache/<namespace>/", "append operations take a monotonic sequence number from a per-namespace counter"], "error_codes": [{"code": "MEMORY_NS_FULL", "message": "A namespace exceeded its configured quota.", "recovery": "Reject the put/append; surface the namespace and quota; do not silently drop."}, {"code": "MEMORY_NS_CORRUPT", "message": "A stored value failed its declared schema on load.", "recovery": "Quarantine the corrupt file, return NotFound, log AIOS-EVENT-000030 memory_corrupt."}, {"code": "MEMORY_IO_FAILED", "message": "Underlying filesystem write failed.", "recovery": "Fail the op; do not claim success. Callers must degrade (Law 9)."}], "performance_guarantees": {"max_latency_ms": 20, "max_memory_mb": 64}, "examples": ["append('events', {type: AIOS-EVENT-000003, payload}) -> result.sequence=12891"]}