{"$schema": "../../schemas/SCHEMA-000015-contract.json", "id": "AIOS-CONTRACT-000051", "name": "security_analysis", "version": "1.0.0", "description": "Static analysis for security anti-patterns, dependency vulnerabilities, and dangerous API usage. Produces a security_score and an actionable fix list per finding.", "inputs": [{"name": "target", "type": "string", "required": true, "description": "Module ID or file path to scan.", "validation": "non-empty"}, {"name": "severity_threshold", "type": "string", "required": false, "description": "Minimum severity to report: critical | high | medium | low", "default": "medium"}], "outputs": [{"name": "security_report", "type": "object", "description": "{ security_score_0to100, findings: [{severity, vuln_type, file, line, fix, cve?}], critical_count, high_count }"}], "side_effects": ["Caches per-target results; invalidated when target file hashes change"], "error_codes": [{"code": "ANALYSIS_TOO_LARGE", "message": "Target has too many files to scan within the performance budget.", "recovery": "Return partial coverage on first N files; suggest a focused target."}, {"code": "ANALYSIS_NO_ENGINE", "message": "No security analyzer registered for this file type.", "recovery": "Skip file; list uncovered file types."}], "performance_guarantees": {"max_latency_ms": 300, "max_memory_mb": 128}, "examples": ["target=path/to/deps.json -> finding with cve if match."]}