{"$schema": "../../schemas/SCHEMA-000015-contract.json", "id": "AIOS-CONTRACT-000102", "name": "bug_detection", "version": "1.0.0", "description": "Analyzes error logs and test failures to identify root causes.", "inputs": [{"name": "evidence", "type": "string", "required": true}], "outputs": [{"name": "analysis", "type": "object", "description": "Root cause list with confidence scores and fix suggestions."}]}