{"$schema": "../../schemas/SCHEMA-000015-contract.json", "id": "AIOS-CONTRACT-000023", "name": "cache_manager", "version": "1.0.0", "description": "Incremental content-addressed cache for analysis, build results, dependency graphs, and brain data. Invalidates entries when their declared inputs (file hashes, module IDs, constitution versions) change. Embodies Engineering Law 8 (Cache Aggressively) and Law 14 (Knowledge Persistence).", "inputs": [{"name": "key", "type": "string", "required": true, "description": "Cache key, typically AIOS-HASH-{sha256_first_12} of the inputs.", "validation": "non-empty"}, {"name": "producer_module_id", "type": "string", "required": true, "description": "Module that produced the value, e.g. AIOS-MODULE-000005 (brain).", "validation": "^AIOS-MODULE-d{6}$"}, {"name": "input_hashes", "type": "array", "required": true, "description": "[{ path or symbol, sha256 }] that this entry depends on. An entry is invalid if any hash changed."}], "outputs": [{"name": "value", "type": "object", "description": "Cached value, or null on miss."}, {"name": "status", "type": "string", "description": "hit | miss | invalidated | stale"}], "side_effects": ["Writes new entries under aios/.cache/<producer_module>/<key>", "Prunes entries exceeding performance_budget.max_cache_mb (Law 10)"], "error_codes": [{"code": "RUNTIME_CACHE_CORRUPT", "message": "Stored value failed schema re-validation on read.", "recovery": "Drop the entry, return miss, log AIOS-EVENT-000017 cache_corrupt. Do not return corrupt data."}, {"code": "RUNTIME_CACHE_FULL", "message": "Cache at performance_budget.max_cache_mb and prune could not free enough.", "recovery": "Evict least-recently-used entries; if still full, return miss and continue uncached."}], "performance_guarantees": {"max_latency_ms": 10, "max_memory_mb": 128}, "examples": ["get(key=H, inputs=[file_a@hash1]) -> hit only if stored entry's input_hash for file_a still equals hash1."]}