{"$schema": "../../schemas/SCHEMA-000015-contract.json", "id": "AIOS-CONTRACT-000093", "name": "compliance_checking", "version": "1.0.0", "description": "Checks project configuration, dependency licenses, and code patterns against a compliance policy. Reports violations and license incompatibilities.", "inputs": [{"name": "project_root", "type": "string", "required": true, "description": "Project root for scanning."}, {"name": "policy", "type": "object", "required": false, "description": "Custom compliance policy overrides.", "default": {}}], "outputs": [{"name": "compliance_report", "type": "object", "description": "{ licenses: [{package, license, approved, comment}], policy_violations: [{rule, severity, file, remediation}], overall_compliant: bool }"}], "side_effects": ["Emits AIOS-EVENT-000091 compliance_checked"], "error_codes": [{"code": "SECURITY_NO_POLICY", "message": "No compliance policy configured and no default available.", "recovery": "Return best-effort license listing; skip policy checks."}], "performance_guarantees": {"max_latency_ms": 3000, "max_memory_mb": 64}, "examples": ["project_root with unknown-license dependency -> compliance_report with violation."]}