{"id":"AIOS-ENTERPRISE-000030","name":"Engineering Timeline","version":"1.0.0","description":"Chronological visualization of all engineering activity — requests, decisions, deployments, rollbacks. Auditable and filterable by date range, module, or event type.","inputs":[{"name":"since","type":"string","required":false},{"name":"until","type":"string","required":false}],"outputs":[{"name":"timeline","type":"object","description":"{ events:[{timestamp,type,summary,module_id,duration_ms}], summary:{by_type,total} }"}]}