{"$schema": "../../schemas/SCHEMA-000015-contract.json", "id": "AIOS-CONTRACT-000022", "name": "parallel_execution", "version": "1.0.0", "description": "Coordinator for concurrent agent and task execution. Spawns isolated execution contexts for sub-agents, enforces declared concurrency caps per engine, and merges their outputs deterministically. Context isolation per Engineering Law 15 (Session Hygiene).", "inputs": [{"name": "tasks", "type": "array", "required": true, "description": "[{ task_id, agent_id or engine_id, demand, depends_on[] }] to execute concurrently."}, {"name": "strategy", "type": "string", "required": false, "description": "Merge strategy: 'race' (first success wins) | 'all' (wait for all) | 'quorum' (majority).", "default": "all"}], "outputs": [{"name": "results", "type": "array", "description": "[{ task_id, status, output, duration_ms, trace_id }]"}, {"name": "merge_key", "type": "string", "description": "Deterministic key combining sorted task_id + status values for reproducibility (Constitution Principle 4)."}], "side_effects": ["Creates isolated context per task; torn down after completion (Law 10, Law 15)", "Emits AIOS-EVENT-000014 task_started and AIOS-EVENT-000015 task_completed"], "error_codes": [{"code": "RUNTIME_TASK_TIMEOUT", "message": "A task exceeded its declared performance_budget.max_latency_ms.", "recovery": "Cancel the task, record partial output if any, propagate AIOS-EVENT-000016 task_timeout."}, {"code": "RUNTIME_DEADLOCK", "message": "Tasks depend on each other cyclically.", "recovery": "Detect cycle, abort the whole batch, surface the cycle to operator (do not silently retry)."}], "performance_guarantees": {"max_latency_ms": 50, "max_memory_mb": 64}, "examples": ["parallel_execute(3 sub-agent tasks, strategy=all) -> results[3] with same merge_key across runs."]}