{"id":"AIOS-ENTERPRISE-000060","name":"Learning Engine","version":"1.0.0","description":"Analyzes execution history to identify patterns, recommend workflow improvements, and suggest knowledge entries. Self-evolution — proposes framework updates for operator approval.","inputs":[{"name":"scope","type":"string","required":false,"description":"history window to analyze."}],"outputs":[{"name":"learnings","type":"object","description":"{ patterns:[{observations,recommendations,confidence}], proposed_updates:[], efficiency_score }"}]}