{"$schema": "../../schemas/SCHEMA-000015-contract.json", "id": "AIOS-CONTRACT-000100", "name": "deployment_planning", "version": "1.0.0", "description": "Produces a deployment plan from an execution plan and the target environment spec. Defines the build, staging, deployment, and rollback steps for each environment.", "inputs": [{"name": "execution_plan", "type": "object", "required": true, "description": "ExecutionPlan from the planner."}, {"name": "environments", "type": "array", "required": false, "description": "Target environments: [dev, staging, production, ...]", "default": ["dev"]}], "outputs": [{"name": "deployment_plan", "type": "object", "description": "{ environment, build_steps: [{step_id, command, artifact}], deploy_steps, health_checks, rollback_steps }"}], "side_effects": ["Emits AIOS-EVENT-000100 deployment_planned"], "error_codes": [{"code": "DEVOPS_ENVIRONMENT_UNKNOWN", "message": "Target environment has no configured profile.", "recovery": "Suggest creating the environment profile; offer a default scaffold."}], "performance_guarantees": {"max_latency_ms": 200, "max_memory_mb": 48}, "examples": ["execution_plan for code change + environments=[staging, production] -> deployment_plan with staged rollout."]}